{
  "$schema": "https://json-schema.org/draft/2020-12/schema",
  "$id": "https://webetsocial.com/docs/agentics-dashboard-schema.json",
  "title": "Agentics Omega shadow ledger",
  "description": "Display payload for https://webetsocial.com/agentics. The read-only function agentics-ledger reads Netlify Blobs store `agentics`, key `omega-shadow/latest.json`, and returns this document. If the key is missing it returns an empty document (empty: true) instead. Publish with the Netlify CLI (verified: blobs:set arguments are store, key, and optional value; --input reads the value from a file): netlify blobs:set agentics omega-shadow/latest.json --input <file>. A filled example is docs/agentics-dashboard-sample.json. Display only. This document does not place orders and does not change Omega picks.",
  "type": "object",
  "additionalProperties": true,
  "x-publish": {
    "command": "netlify blobs:set agentics omega-shadow/latest.json --input <file>",
    "store": "agentics",
    "key": "omega-shadow/latest.json",
    "cli": "https://github.com/netlify/cli/blob/main/docs/commands/blobs.md",
    "verifiedSyntax": "netlify blobs:set <store> <key> --input <file>"
  },
  "required": ["ok", "asOf", "limits", "gate", "summary", "drawdown", "clv", "today", "ledger"],
  "properties": {
    "ok": {
      "type": "boolean",
      "description": "False when the stored object could not be read as a ledger. The empty missing-key document uses true."
    },
    "empty": {
      "type": "boolean",
      "description": "True only for the synthesized document returned when the blob key is missing or unusable. Omit or false for a published ledger."
    },
    "schemaVersion": {
      "const": "1"
    },
    "asOf": {
      "type": "string",
      "format": "date-time",
      "description": "UTC timestamp of this snapshot."
    },
    "etDate": {
      "type": ["string", "null"],
      "pattern": "^[0-9]{4}-[0-9]{2}-[0-9]{2}$",
      "description": "America/New_York date the snapshot covers."
    },
    "mode": {
      "anyOf": [
        { "enum": ["shadow", "paper"] },
        { "type": "null" }
      ],
      "description": "Default execution mode for the ledger. Each position may override it with its own status."
    },
    "currency": {
      "const": "USD"
    },
    "bankroll": {
      "type": ["number", "null"],
      "minimum": 0,
      "description": "Reference bankroll in USD. Drawdown percents are measured against this bankroll."
    },
    "sample": {
      "type": "boolean",
      "description": "True on the checked-in example. The page shows a sample banner and does not treat it as a live record."
    },
    "source": {
      "type": "object",
      "additionalProperties": true,
      "properties": {
        "store": { "const": "agentics" },
        "key": { "const": "omega-shadow/latest.json" }
      }
    },
    "limits": {
      "$ref": "#/$defs/limits"
    },
    "gate": {
      "type": "object",
      "additionalProperties": true,
      "description": "Progress toward the 14-day / 20-trade review gate.",
      "required": ["daysRequired", "tradesRequired", "daysElapsed", "trades"],
      "properties": {
        "daysRequired": { "const": 14 },
        "tradesRequired": { "const": 20 },
        "daysElapsed": {
          "type": "integer",
          "minimum": 0,
          "description": "Calendar days elapsed since startedOn, America/New_York, inclusive of the start date when a position exists that day."
        },
        "trades": {
          "type": "integer",
          "minimum": 0,
          "description": "Positions counted toward the gate, including open positions."
        },
        "startedOn": {
          "type": ["string", "null"],
          "pattern": "^[0-9]{4}-[0-9]{2}-[0-9]{2}$"
        },
        "met": {
          "type": "boolean",
          "description": "True when daysElapsed >= 14 and trades >= 20."
        }
      }
    },
    "summary": {
      "type": "object",
      "additionalProperties": true,
      "required": ["wins", "losses", "pushes", "record", "pl", "roiPct"],
      "properties": {
        "wins": { "type": "integer", "minimum": 0 },
        "losses": { "type": "integer", "minimum": 0 },
        "pushes": { "type": "integer", "minimum": 0 },
        "open": { "type": "integer", "minimum": 0 },
        "record": {
          "type": "string",
          "pattern": "^[0-9]+-[0-9]+-[0-9]+$",
          "description": "wins-losses-pushes, settled positions only."
        },
        "pl": {
          "type": "number",
          "description": "Settled profit/loss in USD after fees. Sum of settled position pl."
        },
        "roiPct": {
          "type": "number",
          "description": "ROI in percent points, not a fraction. 4.2 means +4.2%. Defined as 100 * pl / staked, where staked is settled stake only."
        },
        "staked": {
          "type": "number",
          "minimum": 0,
          "description": "Sum of stake (USD, before fee) on settled positions. Open positions are excluded from ROI."
        }
      }
    },
    "drawdown": {
      "type": "object",
      "additionalProperties": true,
      "required": ["dailyPct", "weeklyPct", "totalPct"],
      "properties": {
        "dailyPct": {
          "type": "number",
          "minimum": 0,
          "description": "Max drawdown today, in percent points of bankroll."
        },
        "weeklyPct": {
          "type": "number",
          "minimum": 0,
          "description": "Max drawdown over the trailing 7 America/New_York days, in percent points of bankroll."
        },
        "totalPct": {
          "type": "number",
          "minimum": 0,
          "description": "Max drawdown since the gate started, in percent points of bankroll."
        },
        "dailyLimitPct": { "const": 5 },
        "weeklyLimitPct": { "const": 7.5 },
        "totalLimitPct": { "const": 12 },
        "withinLimits": {
          "type": "boolean",
          "description": "True when dailyPct <= 5, weeklyPct <= 7.5, and totalPct <= 12."
        }
      }
    },
    "clv": {
      "type": "object",
      "additionalProperties": true,
      "description": "Closing-line value versus the Polymarket close. Positive cents mean the close price was higher than the entry price.",
      "required": ["vs", "byDay"],
      "properties": {
        "vs": { "const": "polymarket-close" },
        "date": {
          "type": ["string", "null"],
          "description": "America/New_York date of the featured daily CLV row. Null when no close has been recorded."
        },
        "avgClvCents": {
          "type": ["number", "null"],
          "description": "Average clvCents for `date`."
        },
        "n": {
          "type": "integer",
          "minimum": 0,
          "description": "Positions included in avgClvCents."
        },
        "byDay": {
          "type": "array",
          "items": { "$ref": "#/$defs/clvDay" }
        }
      }
    },
    "today": {
      "type": "object",
      "additionalProperties": true,
      "required": ["picks"],
      "properties": {
        "date": {
          "type": ["string", "null"],
          "pattern": "^[0-9]{4}-[0-9]{2}-[0-9]{2}$"
        },
        "picks": {
          "type": "array",
          "description": "Today's Omega picks that matched a Polymarket market. Unmatched picks are omitted.",
          "items": { "$ref": "#/$defs/position" }
        }
      }
    },
    "ledger": {
      "type": "array",
      "description": "Running ledger, newest first. Includes open and settled positions.",
      "items": { "$ref": "#/$defs/ledgerRow" }
    }
  },
  "$defs": {
    "limits": {
      "type": "object",
      "additionalProperties": false,
      "required": ["dailyDrawdownPct", "weeklyDrawdownPct", "totalDrawdownPct"],
      "properties": {
        "dailyDrawdownPct": { "const": 5 },
        "weeklyDrawdownPct": { "const": 7.5 },
        "totalDrawdownPct": { "const": 12 }
      }
    },
    "position": {
      "type": "object",
      "additionalProperties": true,
      "required": ["market", "pick", "price", "fee", "stake", "status"],
      "properties": {
        "id": { "type": "string" },
        "sport": { "type": "string" },
        "matchup": { "type": "string" },
        "pick": {
          "type": "string",
          "description": "Omega side that was matched. Example: Dodgers ML."
        },
        "market": {
          "type": "string",
          "description": "Polymarket market name."
        },
        "marketUrl": {
          "type": "string",
          "format": "uri",
          "description": "Optional https URL of the Polymarket market. The page ignores non-https URLs."
        },
        "price": {
          "type": "number",
          "minimum": 0,
          "maximum": 1,
          "description": "Entry price as a probability from 0 to 1. 0.57 displays as 57¢. Not American odds."
        },
        "closePrice": {
          "type": ["number", "null"],
          "minimum": 0,
          "maximum": 1,
          "description": "Polymarket close price as a probability from 0 to 1. Null before the close is known."
        },
        "fee": {
          "type": "number",
          "minimum": 0,
          "description": "USD fee on the position. Not included in stake."
        },
        "stake": {
          "type": "number",
          "minimum": 0,
          "description": "USD paid for the position, before fee."
        },
        "status": {
          "enum": ["shadow", "paper"],
          "description": "shadow: logged only. paper: simulated fill, no live order."
        },
        "result": {
          "anyOf": [
            { "enum": ["open", "win", "loss", "push", "void"] },
            { "type": "null" }
          ]
        },
        "pl": {
          "type": ["number", "null"],
          "description": "USD profit/loss after fee. Null while open. Win: stake * (1 - price) / price - fee. Loss: -(stake + fee). Push or void: 0, or fee only if the fee was kept."
        },
        "clvCents": {
          "type": ["number", "null"],
          "description": "(closePrice - price) * 100. Positive means the Polymarket close was above the entry price."
        }
      }
    },
    "ledgerRow": {
      "allOf": [
        { "$ref": "#/$defs/position" },
        {
          "type": "object",
          "required": ["date"],
          "properties": {
            "date": {
              "type": "string",
              "pattern": "^[0-9]{4}-[0-9]{2}-[0-9]{2}$",
              "description": "America/New_York date of the position."
            }
          }
        }
      ]
    },
    "clvDay": {
      "type": "object",
      "additionalProperties": true,
      "required": ["date", "avgClvCents", "n"],
      "properties": {
        "date": {
          "type": "string",
          "pattern": "^[0-9]{4}-[0-9]{2}-[0-9]{2}$"
        },
        "avgClvCents": {
          "type": ["number", "null"]
        },
        "n": {
          "type": "integer",
          "minimum": 0
        }
      }
    }
  }
}
