{
  "ok": true,
  "empty": false,
  "schemaVersion": "1",
  "sample": true,
  "asOf": "2026-10-10T21:05:00.000Z",
  "etDate": "2026-10-10",
  "mode": "shadow",
  "currency": "USD",
  "bankroll": 10000,
  "source": {
    "store": "agentics",
    "key": "omega-shadow/latest.json"
  },
  "limits": {
    "dailyDrawdownPct": 5,
    "weeklyDrawdownPct": 7.5,
    "totalDrawdownPct": 12
  },
  "gate": {
    "daysRequired": 14,
    "tradesRequired": 20,
    "daysElapsed": 6,
    "trades": 11,
    "startedOn": "2026-10-05",
    "met": false
  },
  "summary": {
    "wins": 6,
    "losses": 3,
    "pushes": 0,
    "open": 2,
    "record": "6-3-0",
    "pl": 845.43,
    "roiPct": 33.75,
    "staked": 2505
  },
  "drawdown": {
    "dailyPct": 1.2,
    "weeklyPct": 2.4,
    "totalPct": 3.1,
    "dailyLimitPct": 5,
    "weeklyLimitPct": 7.5,
    "totalLimitPct": 12,
    "withinLimits": true
  },
  "clv": {
    "vs": "polymarket-close",
    "date": "2026-10-09",
    "avgClvCents": 0,
    "n": 2,
    "byDay": [
      { "date": "2026-10-09", "avgClvCents": 0, "n": 2 },
      { "date": "2026-10-08", "avgClvCents": 0.5, "n": 2 },
      { "date": "2026-10-07", "avgClvCents": 2, "n": 1 },
      { "date": "2026-10-06", "avgClvCents": 1.5, "n": 2 },
      { "date": "2026-10-05", "avgClvCents": 2.5, "n": 2 }
    ]
  },
  "today": {
    "date": "2026-10-10",
    "picks": [
      {
        "id": "sample-2026-10-10-lad",
        "sport": "MLB",
        "matchup": "Mets @ Dodgers",
        "pick": "Dodgers ML",
        "market": "Dodgers vs. Mets",
        "price": 0.57,
        "closePrice": null,
        "fee": 0.84,
        "stake": 250,
        "status": "shadow",
        "result": "open",
        "pl": null,
        "clvCents": null
      },
      {
        "id": "sample-2026-10-10-kc",
        "sport": "NFL",
        "matchup": "Chiefs @ Bills",
        "pick": "Chiefs ML",
        "market": "Chiefs vs. Bills",
        "price": 0.48,
        "closePrice": null,
        "fee": 1.1,
        "stake": 200,
        "status": "paper",
        "result": "open",
        "pl": null,
        "clvCents": null
      }
    ]
  },
  "ledger": [
    {
      "date": "2026-10-10",
      "id": "sample-2026-10-10-lad",
      "sport": "MLB",
      "matchup": "Mets @ Dodgers",
      "pick": "Dodgers ML",
      "market": "Dodgers vs. Mets",
      "price": 0.57,
      "closePrice": null,
      "fee": 0.84,
      "stake": 250,
      "status": "shadow",
      "result": "open",
      "pl": null,
      "clvCents": null
    },
    {
      "date": "2026-10-10",
      "id": "sample-2026-10-10-kc",
      "sport": "NFL",
      "matchup": "Chiefs @ Bills",
      "pick": "Chiefs ML",
      "market": "Chiefs vs. Bills",
      "price": 0.48,
      "closePrice": null,
      "fee": 1.1,
      "stake": 200,
      "status": "paper",
      "result": "open",
      "pl": null,
      "clvCents": null
    },
    {
      "date": "2026-10-09",
      "id": "sample-2026-10-09-nyy",
      "sport": "MLB",
      "matchup": "Yankees @ Red Sox",
      "pick": "Yankees ML",
      "market": "Yankees vs. Red Sox",
      "price": 0.61,
      "closePrice": 0.64,
      "fee": 1.5,
      "stake": 400,
      "status": "shadow",
      "result": "win",
      "pl": 254.24,
      "clvCents": 3
    },
    {
      "date": "2026-10-09",
      "id": "sample-2026-10-09-tex",
      "sport": "MLB",
      "matchup": "Rangers @ Astros",
      "pick": "Rangers ML",
      "market": "Rangers vs. Astros",
      "price": 0.44,
      "closePrice": 0.41,
      "fee": 0.9,
      "stake": 220,
      "status": "paper",
      "result": "loss",
      "pl": -220.9,
      "clvCents": -3
    },
    {
      "date": "2026-10-08",
      "id": "sample-2026-10-08-buf",
      "sport": "NFL",
      "matchup": "Ravens @ Bills",
      "pick": "Bills ML",
      "market": "Bills vs. Ravens",
      "price": 0.55,
      "closePrice": 0.58,
      "fee": 1.25,
      "stake": 350,
      "status": "shadow",
      "result": "win",
      "pl": 285.11,
      "clvCents": 3
    },
    {
      "date": "2026-10-08",
      "id": "sample-2026-10-08-det",
      "sport": "NFL",
      "matchup": "Bears @ Lions",
      "pick": "Lions ML",
      "market": "Lions vs. Bears",
      "price": 0.52,
      "closePrice": 0.5,
      "fee": 0.7,
      "stake": 180,
      "status": "paper",
      "result": "loss",
      "pl": -180.7,
      "clvCents": -2
    },
    {
      "date": "2026-10-07",
      "id": "sample-2026-10-07-gb",
      "sport": "NFL",
      "matchup": "Packers @ Cardinals",
      "pick": "Packers ML",
      "market": "Packers vs. Cardinals",
      "price": 0.58,
      "closePrice": 0.6,
      "fee": 1.1,
      "stake": 300,
      "status": "shadow",
      "result": "win",
      "pl": 216.14,
      "clvCents": 2
    },
    {
      "date": "2026-10-06",
      "id": "sample-2026-10-06-bos",
      "sport": "NHL",
      "matchup": "Bruins @ Maple Leafs",
      "pick": "Bruins ML",
      "market": "Bruins vs. Maple Leafs",
      "price": 0.49,
      "closePrice": 0.51,
      "fee": 1,
      "stake": 275,
      "status": "shadow",
      "result": "win",
      "pl": 285.22,
      "clvCents": 2
    },
    {
      "date": "2026-10-06",
      "id": "sample-2026-10-06-edm",
      "sport": "NHL",
      "matchup": "Oilers @ Flames",
      "pick": "Oilers ML",
      "market": "Oilers vs. Flames",
      "price": 0.46,
      "closePrice": 0.47,
      "fee": 0.8,
      "stake": 200,
      "status": "paper",
      "result": "loss",
      "pl": -200.8,
      "clvCents": 1
    },
    {
      "date": "2026-10-05",
      "id": "sample-2026-10-05-phi",
      "sport": "MLB",
      "matchup": "Phillies @ Mets",
      "pick": "Phillies ML",
      "market": "Phillies vs. Mets",
      "price": 0.63,
      "closePrice": 0.66,
      "fee": 1.3,
      "stake": 320,
      "status": "shadow",
      "result": "win",
      "pl": 186.64,
      "clvCents": 3
    },
    {
      "date": "2026-10-05",
      "id": "sample-2026-10-05-dal",
      "sport": "NFL",
      "matchup": "Cowboys @ Eagles",
      "pick": "Cowboys ML",
      "market": "Cowboys vs. Eagles",
      "price": 0.54,
      "closePrice": 0.56,
      "fee": 1,
      "stake": 260,
      "status": "paper",
      "result": "win",
      "pl": 220.48,
      "clvCents": 2
    }
  ]
}
